{
  "authority": {
    "activation": false,
    "custody": false,
    "execution": false,
    "publication": false,
    "release": false
  },
  "classification": {
    "action_admitted": false,
    "awareness_updated": true,
    "memory_retention": "PROJECT",
    "primary": "EVIDENCE",
    "recovered_into": "StegVerse-Labs/Site",
    "upstream_response_sha256": "6ff6f0833d6d7f0fdd1e5f144c0545f84da8b434d355b1866a99cefc5d2bbbd5"
  },
  "destination_org": "StegVerse-Labs",
  "detail_class": "EVIDENCE",
  "exchange_id": "hb-exchange-20260807-stegverse-labs",
  "message_id": "hb-exchange-20260807-stegverse-labs-recovered",
  "node_org": "StegVerse-Labs",
  "observed_at": "2026-08-07T15:14:15.504559Z",
  "observed_message_sha256": "930e4d1892ff7e1c02d97940c8d538054c81c1b7b601479a240d4aa896111717",
  "parent_receipt_sha256": "6ff6f0833d6d7f0fdd1e5f144c0545f84da8b434d355b1866a99cefc5d2bbbd5",
  "schema_version": "1.0.0",
  "source_org": "StegVerse-Labs",
  "stage": "RECOVERED"
}
